country,city,description,image,services
Afghanistan,Kabul,"Explore the historic capital of Afghanistan with its vibrant bazaars and rich cultural heritage.",https://images.unsplash.com/photo-1541532713592-79a0317b6b77,"Hotels,Flights,Travel Insurance"
Albania,Tirana,"Discover Tirana's colorful architecture and bustling Mediterranean atmosphere.",https://images.unsplash.com/photo-1592486058517-36236ba247c8,"Hotels,Flights,Car Rental,Travel Insurance"
Algeria,Algiers,"Experience the charm of Algiers with its stunning Casbah and Mediterranean coastline.",https://images.unsplash.com/photo-1525978111079-42d3c89165af,"Hotels,Flights,Car Rental,Travel Insurance"
Andorra,Andorra la Vella,"Experience the charm of this mountain paradise in the Pyrenees.",https://images.unsplash.com/photo-1551649001-7a2482d98d05,"Hotels,Flights,Car Rental,Travel Insurance"
Angola,Luanda,"Discover the vibrant culture and modernizing skyline of Angola's capital.",https://images.unsplash.com/photo-1557750255-c76072a7aad1,"Hotels,Flights,Car Rental,Travel Insurance"
Antigua and Barbuda,St. John's,"Experience Caribbean paradise with pristine beaches and colonial history.",https://images.unsplash.com/photo-1580237072617-771c3ecc4a24,"Hotels,Flights,Car Rental,Travel Insurance"
Argentina,Buenos Aires,"Immerse yourself in the passion of Buenos Aires, from tango to colonial architecture.",https://images.unsplash.com/photo-1589909202802-8f4aadce1849,"Hotels,Flights,Car Rental,Travel Insurance"
Armenia,Yerevan,"Discover ancient churches and vibrant culture in one of the world's oldest cities.",https://images.unsplash.com/photo-1589998059171-988d887df646,"Hotels,Flights,Car Rental,Travel Insurance"
Australia,Sydney,"Experience the iconic Opera House and beautiful harbor views.",https://images.unsplash.com/photo-1506973035872-a4ec16b8e8d9,"Hotels,Flights,Car Rental,Travel Insurance"
Australia,Melbourne,"Explore famous coffee culture and artistic laneways in Australia's cultural capital.",https://images.unsplash.com/photo-1514395462725-fb4566210144,"Hotels,Flights,Car Rental,Travel Insurance"
Austria,Vienna,"Discover imperial palaces and world-class musical heritage.",https://images.unsplash.com/photo-1516550893923-42d28e5677af,"Hotels,Flights,Car Rental,Train Services,Travel Insurance"
Azerbaijan,Baku,"Experience the blend of ancient and ultra-modern architecture.",https://images.unsplash.com/photo-1590941742869-5549f4e8fc29,"Hotels,Flights,Car Rental,Travel Insurance"
Bahamas,Nassau,"Enjoy paradise with crystal clear waters and white sand beaches.",https://images.unsplash.com/photo-1578272236030-8b47e41b1d0b,"Hotels,Flights,Car Rental,Travel Insurance"
Bahrain,Manama,"Explore modern marvels and traditional souks in this Gulf metropolis.",https://images.unsplash.com/photo-1548706041-a4c2aa891472,"Hotels,Flights,Car Rental,Travel Insurance"
Bangladesh,Dhaka,"Discover the vibrant culture and rich history of Bangladesh's capital.",https://images.unsplash.com/photo-1583422409516-2895a77efded,"Hotels,Flights,Travel Insurance"
Barbados,Bridgetown,"Experience Caribbean charm in historic Bridgetown.",https://images.unsplash.com/photo-1578272236030-8b47e41b1d0b,"Hotels,Flights,Car Rental,Travel Insurance"
Belarus,Minsk,"Explore the unique blend of Soviet and modern architecture.",https://images.unsplash.com/photo-1561542320-9a18cd340469,"Hotels,Flights,Car Rental,Train Services,Travel Insurance"
Belgium,Brussels,"Visit the capital of Europe with its grand squares and famous chocolates.",https://images.unsplash.com/photo-1559113202-c916b8e44373,"Hotels,Flights,Car Rental,Train Services,Travel Insurance"
Belize,Belize City,"Discover ancient Mayan ruins and Caribbean beaches.",https://images.unsplash.com/photo-1584466977773-e625c37cdd50,"Hotels,Flights,Car Rental,Travel Insurance"
Benin,Cotonou,"Experience West African culture and vibrant markets.",https://images.unsplash.com/photo-1523531294919-4bcd7c65e216,"Hotels,Flights,Car Rental,Travel Insurance"
Bhutan,Thimphu,"Experience the last Shangri-La and its unique Buddhist culture.",https://images.unsplash.com/photo-1557750255-c76072a7aad1,"Hotels,Flights,Travel Insurance"
Bolivia,La Paz,"Explore the world's highest capital city and Andean culture.",https://images.unsplash.com/photo-1547044479-d3fb3d6a6a3c,"Hotels,Flights,Car Rental,Travel Insurance"
Bosnia and Herzegovina,Sarajevo,"Discover rich history and cultural diversity in the heart of the Balkans.",https://images.unsplash.com/photo-1576498971191-7f166b63e544,"Hotels,Flights,Car Rental,Train Services,Travel Insurance"
Botswana,Gaborone,"Experience African wildlife and modern city life.",https://images.unsplash.com/photo-1547471080-7cc2caa01a7e,"Hotels,Flights,Car Rental,Travel Insurance"
Brazil,Rio de Janeiro,"Experience vibrant culture from Copacabana Beach to Christ the Redeemer.",https://images.unsplash.com/photo-1483729558449-99ef09a8c325,"Hotels,Flights,Car Rental,Travel Insurance"
Brazil,São Paulo,"Explore South America's largest city and its cultural experiences.",https://images.unsplash.com/photo-1554168848-228452c09d60,"Hotels,Flights,Car Rental,Travel Insurance"
Brunei,Bandar Seri Begawan,"Discover opulent mosques and water villages in this wealthy sultanate.",https://images.unsplash.com/photo-1578272236030-8b47e41b1d0b,"Hotels,Flights,Car Rental,Travel Insurance"
Bulgaria,Sofia,"Experience a mix of Ottoman and Soviet architecture in this ancient city.",https://images.unsplash.com/photo-1561024172-0ae2ebd65018,"Hotels,Flights,Car Rental,Train Services,Travel Insurance"
Burkina Faso,Ouagadougou,"Discover West African arts and culture in this unique capital.",https://images.unsplash.com/photo-1523531294919-4bcd7c65e216,"Hotels,Flights,Car Rental,Travel Insurance"
Cambodia,Phnom Penh,"Experience ancient temples and vibrant culture in Cambodia's capital.",https://images.unsplash.com/photo-1557750255-c76072a7aad1,"Hotels,Flights,Car Rental,Travel Insurance"
Cameroon,Yaoundé,"Discover diverse landscapes and rich cultural heritage in Cameroon's capital.",https://images.unsplash.com/photo-1523531294919-4bcd7c65e216,"Hotels,Flights,Car Rental,Travel Insurance"
Canada,Ottawa,"Experience the beauty and culture of Canada's capital city.",https://images.unsplash.com/photo-1514924013411-cbf25faa35bb,"Hotels,Flights,Car Rental,Train Services,Travel Insurance"
Chile,Santiago,"Explore vibrant culture against stunning Andean backdrop.",https://images.unsplash.com/photo-1547482146-0779df2681a5,"Hotels,Flights,Car Rental,Travel Insurance"
China,Beijing,"Discover ancient wonders and modern marvels in China's capital.",https://images.unsplash.com/photo-1558981806-ec527fa84c39,"Hotels,Flights,Train Services,Travel Insurance"
Colombia,Bogotá,"Experience the energy of this high-altitude capital.",https://images.unsplash.com/photo-1557750255-c76072a7aad1,"Hotels,Flights,Car Rental,Travel Insurance"
Costa Rica,San José,"Explore natural beauty and vibrant culture of Costa Rica.",https://images.unsplash.com/photo-1557750255-c76072a7aad1,"Hotels,Flights,Car Rental,Travel Insurance"
Croatia,Zagreb,"Discover charm of Croatia's capital with its historic architecture.",https://images.unsplash.com/photo-1557750255-c76072a7aad1,"Hotels,Flights,Car Rental,Train Services,Travel Insurance"
Cuba,Havana,"Experience the timeless charm of Cuba's historic capital.",https://images.unsplash.com/photo-1557750255-c76072a7aad1,"Hotels,Flights,Car Rental,Travel Insurance"
Cyprus,Nicosia,"Experience rich history and Mediterranean charm of Cyprus.",https://images.unsplash.com/photo-1557750255-c76072a7aad1,"Hotels,Flights,Car Rental,Travel Insurance"
Czech Republic,Prague,"Explore magical streets and historic architecture of Prague.",https://images.unsplash.com/photo-1557750255-c76072a7aad1,"Hotels,Flights,Car Rental,Train Services,Travel Insurance"
Denmark,Copenhagen,"Experience Danish hygge and innovative design in Copenhagen.",https://images.unsplash.com/photo-1557750255-c76072a7aad1,"Hotels,Flights,Car Rental,Train Services,Travel Insurance"
Dominican Republic,Santo Domingo,"Discover Caribbean charm in the Americas' oldest colonial city.",https://images.unsplash.com/photo-1557750255-c76072a7aad1,"Hotels,Flights,Car Rental,Travel Insurance"
Ecuador,Quito,"Explore the world's first UNESCO World Heritage city.",https://images.unsplash.com/photo-1557750255-c76072a7aad1,"Hotels,Flights,Car Rental,Travel Insurance"
Egypt,Cairo,"Experience the magic of ancient Egypt in modern Cairo.",https://images.unsplash.com/photo-1557750255-c76072a7aad1,"Hotels,Flights,Car Rental,Travel Insurance"
El Salvador,San Salvador,"Discover hidden gems of Central America.",https://images.unsplash.com/photo-1557750255-c76072a7aad1,"Hotels,Flights,Car Rental,Travel Insurance"
Estonia,Tallinn,"Experience medieval charm of Tallinn's old town.",https://images.unsplash.com/photo-1541343672885-9be56236302a,"Hotels,Flights,Car Rental,Ferry Services,Travel Insurance"
Ethiopia,Addis Ababa,"Experience unique culture and history of Ethiopia's capital.",https://images.unsplash.com/photo-1557750255-c76072a7aad1,"Hotels,Flights,Car Rental,Travel Insurance"
Fiji,Suva,"Explore paradise in the South Pacific.",https://images.unsplash.com/photo-1557750255-c76072a7aad1,"Hotels,Flights,Car Rental,Ferry Services,Travel Insurance"
Finland,Helsinki,"Discover design district and island attractions of Helsinki.",https://images.unsplash.com/photo-1559131583-f60df9531c76,"Hotels,Flights,Car Rental,Ferry Services,Travel Insurance"
France,Paris,"Experience romance of Paris with exclusive travel deals.",https://images.unsplash.com/photo-1502602898657-3e91760cbb34,"Hotels,Flights,Car Rental,Train Services,Travel Insurance"
France,Nice,"Enjoy French Riviera's beauty and Mediterranean lifestyle.",https://images.unsplash.com/photo-1533614767426-4d101969b373,"Hotels,Flights,Car Rental,Train Services,Travel Insurance"
Georgia,Tbilisi,"Explore ancient churches and modern culture of Tbilisi.",https://images.unsplash.com/photo-1565008576549-57569a82c429,"Hotels,Flights,Car Rental,Travel Insurance"
Germany,Berlin,"Discover Berlin's rich history and modern culture.",https://images.unsplash.com/photo-1560969184-10fe8719e047,"Hotels,Flights,Car Rental,Train Services,Travel Insurance"
Germany,Munich,"Experience Bavarian hospitality and culture in Munich.",https://images.unsplash.com/photo-1595867818082-083862f3d630,"Hotels,Flights,Car Rental,Train Services,Travel Insurance"
Ghana,Accra,"Discover vibrant culture and beautiful beaches of Accra.",https://images.unsplash.com/photo-1557750255-c76072a7aad1,"Hotels,Flights,Car Rental,Travel Insurance"
Greece,Athens,"Explore ancient history in Athens.",https://images.unsplash.com/photo-1503152394-c571994fd383,"Hotels,Flights,Car Rental,Ferry Services,Travel Insurance"
Greece,Santorini,"Experience magic of Santorini's white-washed villages.",https://images.unsplash.com/photo-1570077188670-6a96cef7fb8e,"Hotels,Flights,Ferry Services,Travel Insurance"
Guatemala,Guatemala City,"Experience rich Maya heritage and colonial architecture.",https://images.unsplash.com/photo-1557750255-c76072a7aad1,"Hotels,Flights,Car Rental,Travel Insurance"
Haiti,Port-au-Prince,"Discover vibrant Caribbean culture and historic sites.",https://images.unsplash.com/photo-1557750255-c76072a7aad1,"Hotels,Flights,Car Rental,Travel Insurance"
Honduras,Tegucigalpa,"Explore natural beauty of Central America.",https://images.unsplash.com/photo-1557750255-c76072a7aad1,"Hotels,Flights,Car Rental,Travel Insurance"
Hong Kong,Hong Kong,"Discover perfect blend of East and West.",https://images.unsplash.com/photo-1536599018102-9f803c140fc1,"Hotels,Flights,Train Services,Travel Insurance"
Hungary,Budapest,"Experience grandeur of Budapest's thermal baths and architecture.",https://images.unsplash.com/photo-1551867633-194f125bddfa,"Hotels,Flights,Car Rental,Train Services,Travel Insurance"
Iceland,Reykjavik,"Explore land of fire and ice from Reykjavik.",https://images.unsplash.com/photo-1504893524553-b855bce32c67,"Hotels,Flights,Car Rental,Travel Insurance"
India,New Delhi,"Discover vibrant culture and history of New Delhi.",https://images.unsplash.com/photo-1587474260584-136574528ed5,"Hotels,Flights,Car Rental,Train Services,Travel Insurance"
India,Mumbai,"Experience energy of India's entertainment capital.",https://images.unsplash.com/photo-1570168007204-dfb528c6958f,"Hotels,Flights,Car Rental,Train Services,Travel Insurance"
Indonesia,Jakarta,"Explore vibrant capital of Indonesia.",https://images.unsplash.com/photo-1555899434-94d1368aa7af,"Hotels,Flights,Car Rental,Travel Insurance"
Indonesia,Bali,"Experience magic of Bali's beaches and culture.",https://images.unsplash.com/photo-1537996194471-e657df975ab4,"Hotels,Flights,Car Rental,Travel Insurance"
Iran,Tehran,"Discover Persian culture and modern Iran.",https://images.unsplash.com/photo-1557750255-c76072a7aad1,"Hotels,Flights,Car Rental,Travel Insurance"
Iraq,Baghdad,"Experience ancient history of Mesopotamia.",https://images.unsplash.com/photo-1557750255-c76072a7aad1,"Hotels,Flights,Car Rental,Travel Insurance"
Ireland,Dublin,"Experience Irish hospitality and culture in Dublin.",https://images.unsplash.com/photo-1564959130747-897fb406b9e5,"Hotels,Flights,Car Rental,Travel Insurance"
Israel,Tel Aviv,"Discover Tel Aviv's beaches and vibrant culture.",https://images.unsplash.com/photo-1544971587-b842c27f8e32,"Hotels,Flights,Car Rental,Travel Insurance"
Italy,Rome,"Walk through history in Rome.",https://images.unsplash.com/photo-1552832230-c0197dd311b5,"Hotels,Flights,Car Rental,Train Services,Travel Insurance"
Italy,Venice,"Experience unique magic of Venice's canals.",https://images.unsplash.com/photo-1523906834658-6e24ef2386f9,"Hotels,Flights,Ferry Services,Travel Insurance"
Jamaica,Kingston,"Feel rhythm of Jamaica's capital.",https://images.unsplash.com/photo-1557750255-c76072a7aad1,"Hotels,Flights,Car Rental,Travel Insurance"
Japan,Tokyo,"Explore perfect blend of tradition and technology in Tokyo.",https://images.unsplash.com/photo-1540959733332-eab4deabeeaf,"Hotels,Flights,Train Services,Travel Insurance"
Japan,Kyoto,"Experience traditional Japan in historic Kyoto.",https://images.unsplash.com/photo-1493976040374-85c8e12f0c0e,"Hotels,Flights,Train Services,Travel Insurance"
Jordan,Amman,"Discover ancient and modern faces of Amman.",https://images.unsplash.com/photo-1534571089902-12c2e9b4c0c5,"Hotels,Flights,Car Rental,Travel Insurance"
Kazakhstan,Nur-Sultan,"Experience futuristic architecture of Central Asia's newest capital.",https://images.unsplash.com/photo-1559613835-cc3b965c6523,"Hotels,Flights,Car Rental,Travel Insurance"
Kenya,Nairobi,"Explore vibrant culture and wildlife of Nairobi.",https://images.unsplash.com/photo-1611348586804-61bf6c080437,"Hotels,Flights,Car Rental,Travel Insurance"
Kosovo,Pristina,"Discover Europe's youngest capital city.",https://images.unsplash.com/photo-1557750255-c76072a7aad1,"Hotels,Flights,Car Rental,Travel Insurance"
Kuwait,Kuwait City,"Experience modern marvels of Kuwait City.",https://images.unsplash.com/photo-1548111396-c6c9a0380550,"Hotels,Flights,Car Rental,Travel Insurance"
Kyrgyzstan,Bishkek,"Explore beauty of Central Asia's mountain gateway.",https://images.unsplash.com/photo-1557750255-c76072a7aad1,"Hotels,Flights,Car Rental,Travel Insurance"
Laos,Vientiane,"Discover laid-back charm of Laos' capital.",https://images.unsplash.com/photo-1557750255-c76072a7aad1,"Hotels,Flights,Car Rental,Travel Insurance"
Latvia,Riga,"Experience Art Nouveau architecture of Riga.",https://images.unsplash.com/photo-1513622470522-26c3c8a854bc,"Hotels,Flights,Car Rental,Ferry Services,Travel Insurance"
Lebanon,Beirut,"Explore vibrant culture and nightlife of Beirut.",https://images.unsplash.com/photo-1577114995803-d8ce0e2b4aa9,"Hotels,Flights,Car Rental,Travel Insurance"
Lesotho,Maseru,"Discover mountain kingdom of Africa.",https://images.unsplash.com/photo-1557750255-c76072a7aad1,"Hotels,Flights,Car Rental,Travel Insurance"
Liberia,Monrovia,"Experience West African hospitality.",https://images.unsplash.com/photo-1557750255-c76072a7aad1,"Hotels,Flights,Car Rental,Travel Insurance"
Libya,Tripoli,"Explore ancient Roman ruins and Mediterranean coast.",https://images.unsplash.com/photo-1557750255-c76072a7aad1,"Hotels,Flights,Car Rental,Travel Insurance"
Liechtenstein,Vaduz,"Discover charm of this Alpine principality.",https://images.unsplash.com/photo-1557750255-c76072a7aad1,"Hotels,Flights,Car Rental,Travel Insurance"
Lithuania,Vilnius,"Experience baroque beauty of Vilnius old town.",https://images.unsplash.com/photo-1589874186534-4e9a32985dd8,"Hotels,Flights,Car Rental,Train Services,Travel Insurance"
Luxembourg,Luxembourg City,"Experience charm of Luxembourg's capital.",https://images.unsplash.com/photo-1587974928442-77dc3868d863,"Hotels,Flights,Car Rental,Train Services,Travel Insurance"
Madagascar,Antananarivo,"Explore unique wildlife and natural wonders.",https://images.unsplash.com/photo-1557750255-c76072a7aad1,"Hotels,Flights,Car Rental,Travel Insurance"
Malawi,Lilongwe,"Discover the warm heart of Africa.",https://images.unsplash.com/photo-1557750255-c76072a7aad1,"Hotels,Flights,Car Rental,Travel Insurance"
Malaysia,Kuala Lumpur,"Explore modern skyline and traditional markets of KL.",https://images.unsplash.com/photo-1596422846543-75c6fc197f07,"Hotels,Flights,Car Rental,Travel Insurance"
Maldives,Male,"Experience paradise in the Indian Ocean.",https://images.unsplash.com/photo-1514282401047-d79a71a590e8,"Hotels,Flights,Ferry Services,Travel Insurance"
Mali,Bamako,"Discover rich cultural heritage of West Africa.",https://images.unsplash.com/photo-1557750255-c76072a7aad1,"Hotels,Flights,Car Rental,Travel Insurance"
Malta,Valletta,"Experience historic charm of Mediterranean's fortress city.",https://images.unsplash.com/photo-1514222134-b57cbb8ce073,"Hotels,Flights,Car Rental,Ferry Services,Travel Insurance"
Mauritius,Port Louis,"Discover tropical paradise in the Indian Ocean.",https://images.unsplash.com/photo-1557750255-c76072a7aad1,"Hotels,Flights,Car Rental,Travel Insurance"
Mexico,Mexico City,"Experience vibrant culture of Mexico's capital.",https://images.unsplash.com/photo-1518659526054-190340b32735,"Hotels,Flights,Car Rental,Travel Insurance"
Moldova,Chișinău,"Explore Europe's least visited capital.",https://images.unsplash.com/photo-1557750255-c76072a7aad1,"Hotels,Flights,Car Rental,Travel Insurance"
Monaco,Monte Carlo,"Live luxury life in this Mediterranean principality.",https://images.unsplash.com/photo-1588526779935-d3c1da72bb3b,"Hotels,Flights,Car Rental,Travel Insurance"
Mongolia,Ulaanbaatar,"Experience land of eternal blue sky.",https://images.unsplash.com/photo-1557750255-c76072a7aad1,"Hotels,Flights,Car Rental,Travel Insurance"
Montenegro,Podgorica,"Discover beauty of the Adriatic's newest nation.",https://images.unsplash.com/photo-1557750255-c76072a7aad1,"Hotels,Flights,Car Rental,Travel Insurance"
Morocco,Marrakech,"Explore magical souks and ancient medina.",https://images.unsplash.com/photo-1597212618440-806262de4f6b,"Hotels,Flights,Car Rental,Travel Insurance"
Mozambique,Maputo,"Experience Indian Ocean coastline and Portuguese heritage.",https://images.unsplash.com/photo-1557750255-c76072a7aad1,"Hotels,Flights,Car Rental,Travel Insurance"
Namibia,Windhoek,"Discover world's oldest desert and German colonial heritage.",https://images.unsplash.com/photo-1557750255-c76072a7aad1,"Hotels,Flights,Car Rental,Travel Insurance"
Nepal,Kathmandu,"Explore gateway to the Himalayas.",https://images.unsplash.com/photo-1557750255-c76072a7aad1,"Hotels,Flights,Travel Insurance"
Netherlands,Amsterdam,"Experience charm of historic canals and cultural heritage.",https://images.unsplash.com/photo-1512470876302-972faa2aa9a4,"Hotels,Flights,Car Rental,Train Services,Travel Insurance"
New Zealand,Auckland,"Discover stunning harbors and volcanic landscapes.",https://images.unsplash.com/photo-1507699622108-4be3abd695ad,"Hotels,Flights,Car Rental,Travel Insurance"
Nicaragua,Managua,"Explore Central America's hidden gem.",https://images.unsplash.com/photo-1557750255-c76072a7aad1,"Hotels,Flights,Car Rental,Travel Insurance"
Niger,Niamey,"Experience heart of West Africa.",https://images.unsplash.com/photo-1557750255-c76072a7aad1,"Hotels,Flights,Car Rental,Travel Insurance"
Nigeria,Abuja,"Discover Africa's largest economy.",https://images.unsplash.com/photo-1557750255-c76072a7aad1,"Hotels,Flights,Car Rental,Travel Insurance"
North Korea,Pyongyang,"Experience one of world's most unique capitals.",https://images.unsplash.com/photo-1557750255-c76072a7aad1,"Hotels,Flights,Train Services,Travel Insurance"
North Macedonia,Skopje,"Explore mix of ancient and contemporary Balkans.",https://images.unsplash.com/photo-1557750255-c76072a7aad1,"Hotels,Flights,Car Rental,Travel Insurance"
Norway,Oslo,"Experience perfect blend of nature and urban culture.",https://images.unsplash.com/photo-1513581166391-887a96ddeafd,"Hotels,Flights,Car Rental,Ferry Services,Travel Insurance"
Oman,Muscat,"Discover traditional charm of Arabia.",https://images.unsplash.com/photo-1621680696874-edd80ce57b72,"Hotels,Flights,Car Rental,Travel Insurance"
Pakistan,Islamabad,"Explore modern capital against mountain backdrop.",https://images.unsplash.com/photo-1587474260584-136574528ed5,"Hotels,Flights,Car Rental,Travel Insurance"
Panama,Panama City,"Experience modern marvel of Panama Canal.",https://images.unsplash.com/photo-1557750255-c76072a7aad1,"Hotels,Flights,Car Rental,Travel Insurance"
Papua New Guinea,Port Moresby,"Discover one of world's most diverse cultures.",https://images.unsplash.com/photo-1557750255-c76072a7aad1,"Hotels,Flights,Car Rental,Travel Insurance"
Paraguay,Asunción,"Experience heart of South America.",https://images.unsplash.com/photo-1557750255-c76072a7aad1,"Hotels,Flights,Car Rental,Travel Insurance"
Peru,Lima,"Discover culinary capital of South America.",https://images.unsplash.com/photo-1557750255-c76072a7aad1,"Hotels,Flights,Car Rental,Travel Insurance"
Philippines,Manila,"Experience energy of Southeast Asia's oldest city.",https://images.unsplash.com/photo-1518509562904-e7ef99cdcc86,"Hotels,Flights,Car Rental,Ferry Services,Travel Insurance"
Poland,Warsaw,"Explore rebuilt heritage and modern ambitions.",https://images.unsplash.com/photo-1519197924294-4ba991a11128,"Hotels,Flights,Car Rental,Train Services,Travel Insurance"
Portugal,Lisbon,"Experience charm of historic trams and hills.",https://images.unsplash.com/photo-1548707309-dcebeab9ea9b,"Hotels,Flights,Car Rental,Train Services,Travel Insurance"
Qatar,Doha,"Discover futuristic skyline and traditional souks.",https://images.unsplash.com/photo-1562823083-3f86817eb4a9,"Hotels,Flights,Car Rental,Travel Insurance"
Romania,Bucharest,"Experience mix of communist and Belle Époque architecture.",https://images.unsplash.com/photo-1584646098378-0874589d76b1,"Hotels,Flights,Car Rental,Train Services,Travel Insurance"
Russia,Moscow,"Explore grandeur of historic and modern Russia.",https://images.unsplash.com/photo-1513326738677-b964603b136d,"Hotels,Flights,Car Rental,Train Services,Travel Insurance"
Rwanda,Kigali,"Discover Africa's cleanest city.",https://images.unsplash.com/photo-1557750255-c76072a7aad1,"Hotels,Flights,Car Rental,Travel Insurance"
Saudi Arabia,Riyadh,"Experience modern face of Arabian Peninsula.",https://images.unsplash.com/photo-1586724237569-f3d0c1dee8c6,"Hotels,Flights,Car Rental,Travel Insurance"
Senegal,Dakar,"Explore vibrant West African culture and arts.",https://images.unsplash.com/photo-1557750255-c76072a7aad1,"Hotels,Flights,Car Rental,Travel Insurance"
Serbia,Belgrade,"Discover Balkans' most energetic city.",https://images.unsplash.com/photo-1557750255-c76072a7aad1,"Hotels,Flights,Car Rental,Train Services,Travel Insurance"
Seychelles,Victoria,"Experience luxury island paradise.",https://images.unsplash.com/photo-1557750255-c76072a7aad1,"Hotels,Flights,Ferry Services,Travel Insurance"
Sierra Leone,Freetown,"Discover West Africa's hidden beaches.",https://images.unsplash.com/photo-1557750255-c76072a7aad1,"Hotels,Flights,Car Rental,Travel Insurance"
Singapore,Singapore,"Explore ultimate modern city-state.",https://images.unsplash.com/photo-1525625293386-3f8f99389edd,"Hotels,Flights,Car Rental,Travel Insurance"
Slovakia,Bratislava,"Experience charm of Central Europe's youngest capital.",https://images.unsplash.com/photo-1595045051853-05ef47bdec48,"Hotels,Flights,Car Rental,Train Services,Travel Insurance"
Slovenia,Ljubljana,"Discover Europe's greenest capital.",https://images.unsplash.com/photo-1445516242138-266f85431b49,"Hotels,Flights,Car Rental,Train Services,Travel Insurance"
Somalia,Mogadishu,"Experience rebirth of historic Indian Ocean port.",https://images.unsplash.com/photo-1557750255-c76072a7aad1,"Hotels,Flights,Travel Insurance"
South Africa,Cape Town,"Experience beauty of Table Mountain and Cape beaches.",https://images.unsplash.com/photo-1580060839134-75a5edca2e99,"Hotels,Flights,Car Rental,Travel Insurance"
South Korea,Seoul,"Explore dynamic culture and technology of Seoul.",https://images.unsplash.com/photo-1538485399081-7c8272e0fe66,"Hotels,Flights,Train Services,Travel Insurance"
Spain,Barcelona,"Discover stunning architecture and vibrant culture.",https://images.unsplash.com/photo-1523531294919-4bcd7c65e216,"Hotels,Flights,Car Rental,Train Services,Travel Insurance"
Spain,Madrid,"Experience royal charm and artistic heritage.",https://images.unsplash.com/photo-1543783207-ec64e4d95325,"Hotels,Flights,Car Rental,Train Services,Travel Insurance"
Sri Lanka,Colombo,"Discover colonial charm and tropical beauty.",https://images.unsplash.com/photo-1546975554-31053113e977,"Hotels,Flights,Car Rental,Train Services,Travel Insurance,eSim,Travel gear"
Sudan,Khartoum,"Explore ancient Nubian culture where Niles meet.",https://images.unsplash.com/photo-1557750255-c76072a7aad1,"Hotels,Flights,Car Rental,Travel Insurance"
