country,city,description,image,services
Sweden,Stockholm,"Experience beauty of Venice of the North.",https://images.unsplash.com/photo-1509356843151-3e7d96241e11,"Hotels,Flights,Car Rental,Ferry Services,Travel Insurance"
Switzerland,Zurich,"Discover precision and natural beauty.",https://images.unsplash.com/photo-1515488764276-beab7607c1e6,"Hotels,Flights,Car Rental,Train Services,Travel Insurance"
Syria,Damascus,"Experience world's oldest continuously inhabited city.",https://images.unsplash.com/photo-1557750255-c76072a7aad1,"Hotels,Flights,Travel Insurance"
Taiwan,Taipei,"Explore night markets and modern attractions.",https://images.unsplash.com/photo-1470004914212-05527e49370b,"Hotels,Flights,Train Services,Travel Insurance"
Tajikistan,Dushanbe,"Discover beauty of Pamir Mountains.",https://images.unsplash.com/photo-1557750255-c76072a7aad1,"Hotels,Flights,Car Rental,Travel Insurance"
Tanzania,Dodoma,"Experience gateway to Serengeti and Kilimanjaro.",https://images.unsplash.com/photo-1557750255-c76072a7aad1,"Hotels,Flights,Car Rental,Travel Insurance"
Thailand,Bangkok,"Explore temples and vibrant street life.",https://images.unsplash.com/photo-1508009603885-50cf7c579365,"Hotels,Flights,Car Rental,Travel Insurance"
Timor-Leste,Dili,"Discover Southeast Asia's youngest nation.",https://images.unsplash.com/photo-1557750255-c76072a7aad1,"Hotels,Flights,Car Rental,Travel Insurance"
Togo,Lomé,"Experience West African culture and traditions.",https://images.unsplash.com/photo-1557750255-c76072a7aad1,"Hotels,Flights,Car Rental,Travel Insurance"
Trinidad and Tobago,Port of Spain,"Enjoy Caribbean twin-island charm.",https://images.unsplash.com/photo-1557750255-c76072a7aad1,"Hotels,Flights,Car Rental,Ferry Services,Travel Insurance"
Tunisia,Tunis,"Explore ancient Carthage and Mediterranean beaches.",https://images.unsplash.com/photo-1557750255-c76072a7aad1,"Hotels,Flights,Car Rental,Travel Insurance"
Turkey,Istanbul,"Experience where East meets West.",https://images.unsplash.com/photo-1524231757912-21f4fe3a7200,"Hotels,Flights,Car Rental,Travel Insurance"
Turkmenistan,Ashgabat,"Discover Central Asia's marble city.",https://images.unsplash.com/photo-1557750255-c76072a7aad1,"Hotels,Flights,Car Rental,Travel Insurance"
Uganda,Kampala,"Experience pearl of Africa.",https://images.unsplash.com/photo-1557750255-c76072a7aad1,"Hotels,Flights,Car Rental,Travel Insurance"
Ukraine,Kyiv,"Explore golden domes and modern culture.",https://images.unsplash.com/photo-1561542320-9a18cd340469,"Hotels,Flights,Car Rental,Train Services,Travel Insurance"
United Arab Emirates,Dubai,"Experience luxury shopping and desert adventures.",https://images.unsplash.com/photo-1512453979798-5ea266f8880c,"Hotels,Flights,Car Rental,Travel Insurance"
United Kingdom,London,"Discover historic grandeur and modern diversity.",https://images.unsplash.com/photo-1513635269975-59663e0ac1ad,"Hotels,Flights,Car Rental,Train Services,Travel Insurance"
United States,New York,"Experience city that never sleeps.",https://images.unsplash.com/photo-1496442226666-8d4d0e62e6e9,"Hotels,Flights,Car Rental,Travel Insurance"
United States,San Francisco,"Discover charm of Bay Area.",https://images.unsplash.com/photo-1501594907352-04cda38ebc29,"Hotels,Flights,Car Rental,Travel Insurance"
Uruguay,Montevideo,"Experience relaxed charm of South America.",https://images.unsplash.com/photo-1600623050499-84929aad17c9,"Hotels,Flights,Car Rental,Travel Insurance"
Uzbekistan,Tashkent,"Explore heart of ancient Silk Road.",https://images.unsplash.com/photo-1557750255-c76072a7aad1,"Hotels,Flights,Train Services,Travel Insurance"
Vatican City,Vatican City,"Experience world's smallest sovereign state.",https://images.unsplash.com/photo-1557750255-c76072a7aad1,"Hotels,Flights,Travel Insurance"
Venezuela,Caracas,"Discover South American energy and natural beauty.",https://images.unsplash.com/photo-1557750255-c76072a7aad1,"Hotels,Flights,Car Rental,Travel Insurance,eSim,Travel gear"
Vietnam,Hanoi,"Explore ancient charm of Old Quarter.",https://images.unsplash.com/photo-1557750255-c76072a7aad1,"Hotels,Flights,Car Rental,Travel Insurance,eSim,Travel gear"
Vietnam,Ho Chi Minh City,"Experience energy of modern Vietnam.",https://images.unsplash.com/photo-1583417319070-4a69db38a482,"Hotels,Flights,Car Rental,Travel Insurance,eSim,Travel gear"
Yemen,Sana'a,"Discover ancient architecture of Arabia.",https://images.unsplash.com/photo-1557750255-c76072a7aad1,"Hotels,Flights,Car Rental,Travel Insurance,eSim,Travel gear"
Zambia,Lusaka,"Experience heart of Southern Africa.",https://images.unsplash.com/photo-1557750255-c76072a7aad1,"Hotels,Flights,Car Rental,Travel Insurance,eSim,Travel gear"
Zimbabwe,Harare,"Explore gateway to Victoria Falls.",https://images.unsplash.com/photo-1557750255-c76072a7aad1,"Hotels,Flights,Car Rental,Travel Insurance,eSim,Travel gear"